Iberian Lynx,60-70,14-Sep,Yellowish-brown,13-Oct,Carnivore,Mediterranean Scrublands,"Humans, Wildcats",70-80,"Spain, Portugal",Endangered,Felidae,63-67,70-80,Solitary,04-Jan,"The Iberian lynx (Lynx pardinus) is a critically endangered wild cat species native to the Iberian Peninsula, specifically found in Spain and Portugal. Known for its distinctive tufted ears, short tail, and spotted fur, the Iberian lynx is one of the most endangered big cats in the world. It is slightly smaller than other lynx species, with a lean build and strong hunting skills. The Iberian lynx primarily preys on rabbits, which make up the majority of its diet, although it will also hunt birds and other small mammals."
Indri,Up to 70,Up to 6,"Black, White",15-18,Herbivore,Rainforests,"Fossa, Birds of Prey",24-27,Madagascar,Critically Endangered,Indridae,120-140,24-27,Solitary,1,"The indri (Indri indri) is a large, arboreal lemur species native to Madagascar, known for its striking appearance and loud, distinctive calls. It is one of the largest living lemurs, with a body length of about 17 to 24 inches (43 to 60 cm) and a long, bushy tail. The indri has a thick, soft fur coat, usually black and white, with some individuals having a more reddish or yellowish hue. It is highly vocal, with a range of calls that can be heard over long distances, often used for communication with other members of its group. Indris are primarily folivores, feeding on leaves, fruits, and flowers, and are highly specialized in their diet, favoring certain plant species. These lemurs are known for their strong, leaping abilities, capable of making impressive vertical leaps between trees."
Japanese Giant Hornet,35-55,Up to 6,"Yellow, Black",06-Mar,"Carnivore, Insectivore","Forests, Mountains","Birds, Bees",40-58,"Japan, China, Southeast Asia",Not Evaluated,Vespidae,1 week,Not Applicable,Colony-based,Thousands,"The Japanese giant hornet (Vespa mandarinia) is a large species of hornet native to East Asia, including Japan, Korea, China, and parts of Southeast Asia. Known for its impressive size, it can grow up to 2 inches (5 cm) long and has a large, orange-yellow head with powerful mandibles. These hornets are aggressive, particularly when they feel their nest is threatened, and can deliver painful stings that inject venom, which can cause severe reactions in some people. The venom contains toxins that can break down tissue and cause allergic reactions, and in rare cases, stings may lead to death. Japanese giant hornets are predatory and primarily hunt other insects, especially honeybees, which they kill and feed to their larvae."
Japanese Macaque,50-60,14-Oct,Brown,20-30,Omnivore,"Forests, Mountains","Humans, Leopards",30,"Japan, China, North Korea",Least Concern,Cercopithecidae,173-194,30,Social groups,1,"The Japanese macaque (Macaca fuscata), also known as the snow monkey, is a species of monkey native to Japan. It is the northernmost-living non-human primate and is well adapted to cold climates, often found in mountainous areas with snow-covered landscapes, especially in the winter. Japanese macaques have thick fur coats to protect them from the cold and are known for their distinctive red faces and posteriors, especially in mature females. These monkeys are highly social, living in large troops that can number from 20 to over 100 individuals, and they exhibit a wide range of social behaviors, including grooming, playing, and complex hierarchies. Their diet is omnivorous, feeding on fruits, seeds, insects, small animals, and even hot spring water in the winter. Japanese macaques are also known for their cultural behaviors, such as bathing in hot springs during the winter months to keep warm, a behavior most famously observed at Jigokudani Monkey Park."
Kakapo,Up to 60,Up to 4,Green,60+,Herbivore,"Forests, Islands","Rats, Cats",2.5,New Zealand,Critically Endangered,Strigopidae,21-24,2.4,Solitary,1-4 (usually 1),"The kakapo (Strigops habroptilus) is a critically endangered, flightless parrot native to New Zealand, known for its large size, nocturnal habits, and distinctive olive-green plumage. It is one of the heaviest parrot species, weighing up to 9 pounds (4 kg), and has a unique round face with a strong sense of smell, which helps it navigate at night. Once thriving in a predator-free environment, the kakapo's population sharply declined following the introduction of mammals like rats and stoats. With fewer than 250 individuals remaining, the kakapo is now part of a highly managed conservation program, with efforts focused on preserving the species on predator-free islands to ensure its survival."
Kangaroo Rat,15-Jul,0.035-0.15,"Brown, Gray",05-Feb,Herbivore,Deserts,"Snakes, Birds of Prey",16,North America,Least Concern,Heteromyidae,22-24,16,Solitary,05-Feb,"The kangaroo rat (Dipodomys) is a small, nocturnal rodent native to North America, particularly found in arid regions such as deserts and grasslands. Known for its large, strong hind legs, which resemble those of a kangaroo, the kangaroo rat uses these powerful legs to leap long distances, often to escape predators or to travel between food sources. These rats are well-adapted to desert life, able to survive with little water by obtaining moisture from their seeds and grains, which make up most of their diet. Kangaroo rats have specialized kidneys that help conserve water, and they typically spend most of their time in burrows, which provide shelter from extreme temperatures."
King Cobra,Up to 550,Up to 9,Olive-green,20-30,Carnivore,"Grasslands, Forests","Birds, Snakes",20,"Southeast Asia, South Asia",Vulnerable,Elapidae,90-113,20,Solitary,20-40,"The king cobra (Ophiophagus hannah) is the longest venomous snake in the world, capable of growing up to 18 feet (5.5 meters) in length. Native to Southeast Asia and parts of South Asia, it is known for its distinctive hood, which it expands when threatened, making it one of the most fearsome snakes. The king cobra's diet primarily consists of other snakes, including venomous species, and it is a skilled predator capable of overpowering much larger prey. Despite its fearsome reputation, the king cobra is generally shy and avoids human contact unless provoked. Its venom is a potent neurotoxin that can cause paralysis and death, and a single bite can deliver enough venom to kill an elephant. King cobras are also notable for their ability to control their venom output, allowing them to deliver a dry bite if they do not need to inject venom."
Kiwi,25-46,1.0-3.3,Brown,25-50,Omnivore,Forests,"Stoats, Cats",6.4-9.6,New Zealand,Vulnerable,Apterygidae,63-92,9,Solitary,1,"The kiwi (Apteryx) is a small, flightless bird native to New Zealand, known for its unique appearance and behavior. It has a round, stout body covered with shaggy brown feathers, and a long, slender bill with sensitive nostrils at the tip, which it uses to forage for food. Unlike most birds, kiwis have a keen sense of smell and use it to search for insects, worms, and other invertebrates in the forest floor. They are nocturnal and have relatively poor vision, relying more on their sense of smell and hearing to navigate in the dark. Kiwis are also characterized by their small wings, which are vestigial and incapable of flight, and their strong, muscular legs, which help them dig for food. New Zealand's iconic national bird, the kiwi is also known for laying one of the largest eggs relative to its body size of any bird species. Unfortunately, kiwis are at risk of extinction due to habitat destruction, introduced predators, and low reproductive rates."
Komodo Dragon,Up to 300,Up to 90,Grey,20-30,Carnivore,"Islands, Grasslands","Humans, Larger Predators",20,Indonesia,Vulnerable,Varanidae,7-8 months,20,Solitary,20-25,"The Komodo dragon (Varanus komodoensis) is the largest living species of lizard, native to the islands of Komodo, Rinca, Flores, and Gili Motang in Indonesia. These impressive reptiles can grow up to 10 feet (3 meters) long and weigh over 150 pounds (70 kg). Komodo dragons are apex predators in their habitats, feeding on a variety of prey, including deer, wild boar, and even water buffalo. They are carnivorous and use a combination of strength, stealth, and a powerful bite to capture and subdue their prey. Komodo dragons have a unique hunting technique, often ambushing their prey and using their toxic saliva, which contains bacteria, to weaken and kill it. They can track their prey over long distances using their keen sense of smell, and once the prey is subdued, they use their powerful jaws and sharp teeth to tear it apart."
Leaf-tailed Gecko,Up to 25,Up to 250,Various,15-Oct,Insectivore,"Rainforests, Madagascar","Birds, Snakes",0.8-1,Madagascar,Not Evaluated,Gekkonidae,45-60,Not Applicable,Solitary,02-Jan,"The leaf-tailed gecko (Uroplatus) is a fascinating genus of geckos native to the rainforests of Madagascar. These geckos are known for their remarkable camouflage, as their flattened, leaf-shaped bodies and tails make them blend perfectly with the surrounding foliage, especially tree bark or leaves. This cryptic coloration helps them avoid predators and ambush prey. Leaf-tailed geckos have large, round eyes and are nocturnal, primarily hunting insects and other small invertebrates during the night. Their tails are particularly distinctive, often resembling dead leaves or twigs, which adds to their ability to remain hidden in their natural habitat."
Leafy Sea Dragon,Up to 35,Up to 0.5,"Brown, Green",Up to 10,Carnivore,Seaweed Beds,"Fish, Octopuses",Not Applicable,Southern Australia,Near Threatened,Syngnathidae,30-40,Not Applicable,Solitary,Up to 300,"The leafy sea dragon (Phycodurus eques) is a marine fish closely related to the seahorse, native to the waters off the southern and western coasts of Australia. Known for its striking appearance, the leafy sea dragon is named for the leaf-like appendages that protrude from its body, which resemble seaweed or algae. These appendages help the fish blend seamlessly with its kelp and seagrass habitat, providing camouflage from predators. Unlike seahorses, leafy sea dragons have elongated, slender bodies covered in bony plates, and they lack the typical seahorse tail that can grasp onto objects. Leafy sea dragons are slow swimmers, using their dorsal fin for propulsion, while their pectoral fins help with steering. They feed on small crustaceans, plankton, and other tiny marine organisms. These creatures are also notable for their unusual reproductive strategy, where the male carries the eggs, much like seahorses, before they hatch."
Lemur,30-50,0.6-3.5,Various,15-25,Omnivore,"Rainforests, Madagascar","Fossa, Hawks",24-29,Madagascar,Vulnerable,Lemuridae,134-138,29,Group-based,02-Jan,"Lemurs are a diverse group of primates native to Madagascar, known for their distinctive large eyes, long tails, and social behaviors. They are primarily arboreal, living in the island's rainforests and dry forests, and are known for their vocalizations, scent-marking, and complex social structures. Lemurs are omnivorous, feeding on fruits, leaves, and insects, depending on the species. One of the most iconic lemurs is the ring-tailed lemur, with its striking black-and-white striped tail."
Lion-tailed Macaque,45-60,2.5-10,Black,20-30,"Omnivore, Herbivore","Western Ghats, India","Tigers, Leopards",30-40,India,Endangered,Cercopithecidae,150-170,35,Social groups,1,"The lion-tailed macaque (Macaca silenus) is a primate species found exclusively in the rainforests of southwestern India. Named for its distinctive tuft of silver-gray fur on the end of its tail, which resembles a lion’s mane, this macaque is medium-sized with dark fur and a bare face. Lion-tailed macaques are arboreal, spending most of their time in trees, where they forage for fruits, leaves, seeds, and small insects. They are social animals, living in groups, but are generally shy and avoid human contact."
Lyrebird,80-100,0.9-1.2,"Brown, Black",15-20,Omnivore,Rainforests,"Birds of Prey, Dingoes",0.02-0.03,Australia,Least Concern,Menuridae,50-55,Not Applicable,Solitary,1,"The lyrebird is a remarkable species of songbird native to Australia, known for its extraordinary ability to mimic sounds from its environment. There are two species of lyrebird: the superb lyrebird (Menura novaehollandiae) and the northern lyrebird (Menura albertensis). Lyrebirds are best known for the elaborate, tail feathers of the male, which resemble the shape of a lyre when fanned out during courtship displays. These birds are exceptional vocalists, capable of imitating a wide range of sounds, including chainsaws, camera shutters, car alarms, and the calls of other birds and animals."
Malayan Krait,Up to 150,Up to 2.2,"Black, Yellow",15-Oct,Carnivore,"Forests, Grasslands","Mongooses, Birds",Not Applicable,Southeast Asia,Least Concern,Elapidae,180-270,Not Applicable,Solitary,16-Aug,"The Malayan krait (Bungarus candidus) is a venomous snake found in Southeast Asia, particularly in Malaysia, Thailand, Singapore, and Indonesia. It is known for its distinctive black and white or bluish-gray banding, which gives it a striking appearance. This nocturnal and semi-terrestrial species primarily preys on other snakes and small vertebrates. Its venom is highly neurotoxic, capable of causing paralysis and respiratory failure, making its bite potentially fatal if untreated."
Manatee,300-400,400-590,"Gray, Brown",40-60,Herbivore,"Rivers, Coastal Areas","Alligators, Sharks",8,"North, Central, and South America",Vulnerable,Trichechidae,365-450,8,Solitary,1,"The manatee is a large, slow-moving marine mammal known for its gentle nature and rounded, grayish body. Often referred to as ""sea cows,"" manatees are herbivores that primarily feed on aquatic plants such as seagrass and algae. They can be found in shallow coastal waters, rivers, and estuaries in the southeastern United States, Central and South America, and West Africa, depending on the species. Manatees have a distinctively large, paddle-shaped tail, and two front flippers, which they use for steering, though they do not have hind limbs. These mammals are known for their slow swimming, reaching speeds of up to 5 miles per hour, but they can travel long distances in search of food."
Mandrill,Up to 75,Up to 55,"Brown, Green",20-40,Omnivore,Rainforests,"Leopards, Humans",30,Central Africa,Vulnerable,Cercopithecidae,175-190,30,Social groups,1,"The mandrill (Mandrillus sphinx) is a large and colorful primate native to the rainforests and savannas of Central and West Africa, particularly in countries like Gabon, Cameroon, and Equatorial Guinea. It is a member of the monkey family and is closely related to baboons. Mandrills are known for their striking appearance, with males displaying bright blue and red facial coloration, a feature that is enhanced during mating seasons, and a colorful rump. The mandrill's body is robust, with males being significantly larger than females, weighing up to 35 kg (77 lbs) compared to the females' 15 kg (33 lbs). They are omnivorous and have a varied diet that includes fruits, leaves, seeds, small animals, and insects. Mandrills live in large, social groups called troops, which can consist of up to several hundred individuals. Their social structure is complex, and they use vocalizations, facial expressions, and body language to communicate with one another. Mandrills are primarily terrestrial but also spend time in trees, and they are known for their impressive speed and agility on the ground. While they are not currently endangered, they are threatened by habitat loss and hunting, making conservation efforts important to protect this unique species."
Maned Wolf,67-107,20-25,Reddish-Brown,08-Jun,Omnivore,"Grasslands, Forests","Jaguars, Pumas",56,South America,Near Threatened,Canidae,65-70,56,Solitary,06-Feb,"The maned wolf (Chrysocyon brachyurus) is a unique and large canid native to the grasslands and savannas of South America. Recognizable by its long, slender legs, large ears, and reddish-gold fur, the maned wolf stands about 70 cm (28 inches) tall and weighs 20-30 kg (44-66 lbs). Unlike other wolves, it is not a true wolf but a distinct species with a diet that includes fruits, small mammals, birds, and insects, with a particular preference for the Solanum fruit. Maned wolves are solitary and nocturnal, using their keen sense of smell to forage alone. They are considered near-threatened due to habitat loss, human-wildlife conflict, and road traffic accidents, making conservation efforts essential to protect their dwindling populations."
Mantis Shrimp,Up to 30,Up to 2.7,Various,Up to 20,Carnivore,Coral Reefs,Larger Fish,30-50,Oceans worldwide,Not Evaluated,Stomatopoda,20-30,30-50,Solitary,Hundreds,"Mantis shrimp are fascinating marine crustaceans known for their vibrant colors, powerful claws, and extraordinary vision. Found in tropical and subtropical oceans, especially in coral reefs, mantis shrimp can grow up to 18 cm (7 inches) long, though most species are smaller. They are famous for their claws, which they use to strike with incredible speed and force — faster than a bullet fired from a gun — to stun or kill prey such as fish and mollusks. These strikes are so powerful that they can break glass aquarium walls. Mantis shrimp are also renowned for their complex and specialized eyes, which have 16 types of photoreceptor cells (compared to humans' 3), allowing them to see an extraordinary range of colors, ultraviolet light, and polarized light. There are two primary types of mantis shrimp: ""smashers,"" which have club-like claws used to crush prey, and ""piercers,"" which have spiny claws used to spear prey. These crustaceans are solitary and territorial, often living in burrows or crevices in the ocean floor."
Markhor,Up to 115,Up to 110,"Brown, Gray",13-Oct,Herbivore,Mountains,"Wolves, Snow Leopards",40-64,"Central Asia, South Asia, Middle East",Near Threatened,Bovidae,135-170,40-64,Solitary,02-Jan,"The markhor (Capra falconeri) is a species of wild goat found in the mountainous regions of Central Asia, particularly in Afghanistan, northern Pakistan, Tajikistan, and parts of India and Uzbekistan. Known for its impressive, twisted horns, the markhor is a large goat with males typically weighing between 32 and 115 kg (70 to 250 lbs) and females being smaller. The horns of adult males can grow up to 1.5 meters (5 feet) long, spiraling in a unique corkscrew shape, while females have shorter, straighter horns. Markhors have a thick, coarse coat that helps them survive the harsh, cold climates of their high-altitude habitats. They are herbivores, feeding on grasses, leaves, and shrubs, and are skilled climbers, able to navigate steep, rocky terrain with ease. Markhor populations have historically been threatened by hunting for their meat, horns, and pelts, as well as habitat loss due to deforestation and human encroachment. Conservation efforts, including hunting restrictions and habitat protection, have helped stabilize their numbers, but they remain classified as ""Endangered"" due to their limited range and ongoing threats."
Meerkat,25-35,0.6-1,"Brown, Tan",14-Dec,"Omnivore, Insectivore",Arid regions,"Eagles, Jackals",32,"Kalahari Desert, Africa",Least Concern,Herpestidae,70-73,32,Social groups,05-Feb,"The meerkat (Suricata suricatta) is a small, social mongoose species native to the arid regions of southern Africa, particularly in countries like Botswana, Namibia, and South Africa. Known for their upright posture, when standing on their hind legs to scan for predators or watch over their group, meerkats have a distinctive appearance with a slender body, pointed face, and large eyes. Typically weighing about 0.6 to 1 kg (1.3 to 2.2 lbs), they live in tightly-knit family groups called mobs, clans, or gangs, which can consist of up to 30 individuals. Meerkats are highly social animals and work cooperatively, with each group member taking on specific roles, such as sentry duty to guard against predators or helping to forage for food. Their diet consists of insects, small reptiles, and plants, and they are skilled diggers, using their strong claws to search for food in the ground. Meerkats are famous for their complex social structure and communication skills, using a variety of vocalizations and body language to stay in contact. Although their populations are generally stable, meerkats face threats from habitat destruction and predators like birds of prey."
Monitor Lizard,Up to 244,Up to 166,Varies,Varies,Carnivore,Various,"Birds, Snakes",Varies,"Africa, Asia, Australia, Oceania",Varies,Varanidae,Varies,Varies,Solitary,Varies,"Monitor lizards are a large group of lizards belonging to the genus Varanus, which includes over 70 species found primarily in Africa, Asia, and Oceania. Known for their long bodies, powerful tails, and strong limbs, monitor lizards are among the largest and most intelligent lizards in the world. Some species, like the Komodo dragon (Varanus komodoensis), can grow up to 3 meters (10 feet) long, while smaller species may only reach 30 cm (12 inches). Monitor lizards are carnivorous, feeding on a variety of prey, including insects, birds, small mammals, and even carrion. They are skilled hunters and use their keen sense of smell to locate food, often employing a forked tongue to detect scents in the air. Many species are also good swimmers, and some, like the water monitor (Varanus salvator), are frequently found near water. Monitor lizards are generally solitary and territorial, with a wide range of behaviors and adaptations suited to different environments, from arid deserts to tropical forests. They also have a reputation for being highly intelligent, capable of problem-solving and even learning through observation. However, several species are threatened by habitat loss, hunting, and the illegal pet trade."
Mountain Gorilla,120-200,70-200,"Black, Brown",35-40,Herbivore,"Rainforests, Mountains","Leopards, Humans",40,"Democratic Republic of Congo, Uganda",Endangered,Hominidae,255-270,40,Group-based,1,"The mountain gorilla (Gorilla beringei beringei) is a subspecies of the eastern gorilla, found primarily in the dense montane forests of the Virunga Mountains, which straddle the borders of Rwanda, Uganda, and the Democratic Republic of Congo. Mountain gorillas are large, powerful primates, with males, known as silverbacks due to the silver-colored fur on their backs, weighing up to 220 kg (485 lbs), and females typically weighing half that. They have a robust build, with broad chests, muscular arms, and a thick coat of fur that helps them survive in the cool, misty mountain environment at altitudes between 2,000 and 4,000 meters (6,500 to 13,000 feet). Mountain gorillas are primarily herbivorous, feeding on leaves, stems, fruit, and bamboo. They live in family groups led by a dominant silverback, who is responsible for protecting the group and making decisions related to food and movement. Despite their intimidating appearance, mountain gorillas are gentle and peaceful animals. They are critically endangered, with only a few hundred individuals remaining, mainly due to habitat loss, poaching, and disease transmission from humans. Conservation efforts, including eco-tourism, habitat restoration, and anti-poaching initiatives, have helped to stabilize and even increase their population in recent years, but they remain at risk."
Naked Mole Rat,Up to 9,Up to 80,"Pink, Wrinkled",Up to 32,"Herbivore, Insectivore",Underground Tunnels,"Snakes, Humans",0.03-0.08,East Africa,Least Concern,Heterocephalidae,70,Not Applicable,Eusocial,Up to 28,"The naked mole-rat (Heterocephalus glaber), also known as the sand puppy, is a burrowing rodent native to the Horn of Africa and parts of Kenya, notably in Somali regions. It is closely related to the blesmols and is the only species in the genus Heterocephalus.

The naked mole-rat exhibits a highly unusual set of physiological and behavioral traits that allow it to thrive in a harsh underground environment; most notably its being the only mammalian thermoconformer with an almost entirely ectothermic (cold-blooded) form of body temperature regulation, as well as exhibiting a complex social structure split between reproductive and non-reproductive castes, making it and the closely related Damaraland mole-rat (Fukomys damarensis) the only widely recognized examples of eusociality (the highest classification of sociality) in mammals. The naked mole-rat lacks pain sensitivity in its skin, and has very low metabolic and respiratory rates. It is also remarkable for its longevity and its resistance to cancer and oxygen deprivation.

While formerly considered to belong to the same family as other African mole-rats, Bathyergidae, more recent investigation places it in a separate family, Heterocephalidae."
