Pronghorn,81-104,40-70,"Brown, White",15-Oct,Herbivore,Grasslands,"Coyotes, Bobcats",88.5,North America,Least Concern,Antilocapridae,240,88.5,Group-based,1,"The pronghorn (Antilocapra americana) is a species of artiodactyl (even-toed, hoofed) mammal indigenous to interior western and central North America. Though not an antelope, it is known colloquially in North America as the American antelope, prong buck, pronghorn antelope and prairie antelope, because it closely resembles the antelopes of the Old World and fills a similar ecological niche due to parallel evolution. It is the only surviving member of the family Antilocapridae.

During the Pleistocene epoch, about 11 other antilocaprid species existed in North America, many with long or spectacularly-twisted horns. Three other genera (Capromeryx, Stockoceros and Tetrameryx) existed when humans entered North America but are now extinct.

The pronghorn's closest living relatives are the giraffe and okapi. The Antilocaprids are part of the infraorder Pecora, making them distant relatives of deer, bovids, and moschids.

The pronghorn is the fastest land mammal in the Americas, with running speeds of up to 88.5 km/h (55 mph). It is the symbol of the American Society of Mammalogists."
Pufferfish,Up to 60,Up to 0.8,Various,10-Mar,Carnivore,Tropical and Subtropical,"Sharks, Humans",8,Oceans worldwide,Not Evaluated,Tetraodontidae,Not Applicable,8,Solitary,Not Applicable,"Tetraodontidae is a family of primarily marine and estuarine fish of the order Tetraodontiformes. The family includes many familiar species variously called pufferfish, puffers, balloonfish, blowfish, blowers, blowies, bubblefish, globefish, swellfish, toadfish, toadies, toadle, honey toads, sugar toads, and sea squab. They are morphologically similar to the closely related porcupinefish, which have large external spines (unlike the thinner, hidden spines of the Tetraodontidae, which are only visible when the fish have puffed up).

The majority of pufferfish species are toxic, with some among the most poisonous vertebrates in the world. In certain species, the internal organs, such as the liver, and sometimes the skin, contain tetrodotoxin, and are highly toxic to most animals when eaten; nevertheless, the meat of some species is considered a delicacy in Japan, Korea, and China  when prepared by specially trained chefs who know which part is safe to eat and in what quantity. Other pufferfish species with nontoxic flesh, such as the northern puffer, Sphoeroides maculatus, of Chesapeake Bay, are considered a delicacy elsewhere."
Quokka,40-54,2.5-5,"Brown, Gray",10-May,Herbivore,"Scrublands, Forests","Foxes, Cats",24,Australia,Vulnerable,Macropodidae,25-30,24,Solitary,1,"The quokka (Setonix brachyurus) is a small macropod about the size of a domestic cat. It is the only member of the genus Setonix. Like other marsupials in the macropod family (such as kangaroos and wallabies), the quokka is herbivorous and mainly nocturnal.

The quokka's range is a small area of southwestern Australia. They inhabit some smaller islands off the coast of Western Australia, particularly Rottnest Island just off Perth and Bald Island near Albany. Isolated, scattered populations also exist in forest and coastal heath between Perth and Albany. A small colony inhabits a protected area of Two Peoples Bay Nature Reserve, where they co-exist with the critically endangered Gilbert's potoroo.
"
Red Fox,35-50,07-Mar,Reddish-brown,05-Mar,Omnivore,"Forests, Grasslands","Wolves, Eagles",48,"North America, Europe, Asia",Least Concern,Canidae,52,48,Solitary,06-Apr,"The red fox (Vulpes vulpes) is the largest of the true foxes and one of the most widely distributed members of the order Carnivora, being present across the entire Northern Hemisphere including most of North America, Europe and Asia, plus parts of North Africa. It is listed as least concern on the IUCN Red List. Its range has increased alongside human expansion, having been introduced to Australia, where it is considered harmful to native small and medium-sized rodents and marsupials. Due to its impact on native species, it is included on the list of the ""world's 100 worst invasive species"".

The red fox originated in Eurasia during the Middle Pleistocene at least 400,000 years ago and later colonised North America sometime prior to 130,000 years ago. Among the true foxes, the red fox represents a more progressive form in the direction of carnivory. Apart from its large size, the red fox is distinguished from other fox species by its ability to adapt quickly to new environments. Despite its name, the species often produces individuals with other colourings, including leucistic and melanistic individuals. Forty-five subspecies are currently recognised, which are divided into two categories: the large northern foxes and the small, basal southern grey desert foxes of Asia and North Africa.

Red foxes are usually found in pairs or small groups consisting of families, such as a mated pair and their young, or a male with several females having kinship ties. The young of the mated pair remain with their parents to assist in caring for new kits. The species primarily feeds on small rodents, though it may also target rabbits, squirrels, game birds, reptiles, invertebrates and young ungulates. Fruit and vegetable matter is also eaten sometimes. Although the red fox tends to kill smaller predators, including other fox species, it is vulnerable to attack from larger predators, such as wolves, coyotes, golden jackals, large predatory birds such as golden eagles and Eurasian eagle owls, and medium- and large-sized felids.
"
Red Kangaroo,140-180,18-95,"Brown, Red",Up to 23,Herbivore,Grasslands,"Dingoes, Eagles",56,Australia,Least Concern,Macropodidae,30-34,56,Group-based,1,"The red kangaroo (Osphranter rufus) is the largest of all kangaroos, the largest terrestrial mammal native to Australia, and the largest extant marsupial. It is found across mainland Australia, except for the more fertile areas, such as southern Western Australia, the eastern and southeastern coasts, and the rainforests along the northern coast.

This species is a very large kangaroo with long, pointed ears and a square shaped muzzle (snout/nose). They are sexually dimorphic; males have short, red-brown fur, fading to pale buff below and on the limbs, while females are smaller than males and are blue-grey with a brown tinge and pale grey below, although arid zone females are coloured more like males. It has two forelimbs with small claws, two muscular hind-limbs, which are used for jumping, and a strong tail which is often used to create a tripod when standing upright.
"
Red Panda,50-65,06-Mar,Reddish-brown,12-Aug,Herbivore,Himalayan Foothills,"Snow Leopards, Martens",0.2-0.4,"China, Nepal, Bhutan, India",Endangered,Ailuridae,112-158,0.2-0.4,Solitary,04-Jan,"The red panda (Ailurus fulgens), also known as the lesser panda, is a small mammal native to the eastern Himalayas and southwestern China. It has dense reddish-brown fur with a black belly and legs, white-lined ears, a mostly white muzzle and a ringed tail. Its head-to-body length is 51–63.5 cm (20.1–25.0 in) with a 28–48.5 cm (11.0–19.1 in) tail, and it weighs between 3.2 and 15 kg (7.1 and 33.1 lb). It is well adapted to climbing due to its flexible joints and curved semi-retractile claws.

The red panda was formally described in 1825. The two currently recognised subspecies, the Himalayan and the Chinese red panda, genetically diverged about 250,000 years ago. The red panda's place on the evolutionary tree has been debated, but modern genetic evidence places it in close affinity with raccoons, weasels, and skunks. It is not closely related to the giant panda, which is a bear, though both possess elongated wrist bones or ""false thumbs"" used for grasping bamboo. The evolutionary lineage of the red panda (Ailuridae) stretches back around 25 to 18 million years ago, as indicated by extinct fossil relatives found in Eurasia and North America.

The red panda inhabits coniferous forests as well as temperate broadleaf and mixed forests, favouring steep slopes with dense bamboo cover close to water sources. It is solitary and largely arboreal. It feeds mainly on bamboo shoots and leaves, but also on fruits and blossoms. Red pandas mate in early spring, with the females giving birth to litters of up to four cubs in summer. It is threatened by poaching as well as destruction and fragmentation of habitat due to deforestation. The species has been listed as Endangered on the IUCN Red List since 2015. It is protected in all range countries.

Community-based conservation programmes have been initiated in Nepal, Bhutan and northeastern India; in China, it benefits from nature conservation projects. Regional captive breeding programmes for the red panda have been established in zoos around the world. It is featured in animated movies, video games, comic books and as the namesake of companies and music bands."
Red-Eyed Tree Frog,5.1-7.5,Up to 0.1,"Green, Red",Up to 5,Insectivore,Rainforests,"Snakes, Birds",Not Applicable,Central America,Least Concern,Hylidae,07-May,Not Applicable,Solitary,Up to 100,"Agalychnis callidryas, commonly known as the red-eyed tree frog or red-eyed leaf frog, is a species of frog in the subfamily Phyllomedusinae. It is one of the most recognizable frogs. It is native to forests from Central America to north-western South America. This species is known for its bright coloration, namely its vibrant green body with blue and yellow stripes on the side. It has a white underside, brightly red and orange colored feet, and is named after its distinctive bright red eyes. One particular and special feature of the frogs coloration is its exceptional high reflectance in the near-

Agalychnis callidryas is an arboreal frog with long limbs and webbed toes. They mate and reproduce near ponds, and are therefore found in lowland wet areas found in tropical forests.

Like all the frogs in its genus, they are nocturnal and do most of their hunting for insects at night. The males of this species are smaller than the females, and they display non-random mating patterns which suggest female choice for specific types of male. Despite its bright coloration, the red-eyed tree frog is not poisonous. Its bright coloration can thus be more attributed to camouflage amongst the greenery of the surrounding jungle, as well as the “startle reflex,” which it can use to dissuade predators. During the day, the frog uses its green back to camouflage amongst the leaves, this camouflage being its only defense. If disturbed, the frog flashes its bright red eyes, which may startle predators and allow the frog to escape.

Along with its visual appearance, phenotypic plasticity in hatching is another interesting feature of A. callidryas. If faced with the vibrational cues associated with predators, A. callidryas embryos may hatch early and fall into the water to escape predation. This response is extremely specific, and mostly occurs only at vibrational patterns associated with predators. These frogs have a distinct temperature requirement and need a body of water to reproduce, and are thus only found in humid lowlands and rainforests of South and Central America.
"
Rottweiler,56-69,36-60,"Black, Tan",10-Aug,Carnivore,Worldwide,"Wolves, Coyotes",35,Worldwide,Not Applicable,Canidae,61-65,32,Pack-based,12-Jun,"The Rottweiler is a breed of domestic dog, regarded as medium-to-large or large. The dogs were known in German as Rottweiler Metzgerhund, meaning Rottweil butchers' dogs, because their main use was to herd livestock and pull carts laden with butchered meat to market. This continued until the mid-19th century when railways replaced droving. Although still used to herd stock in many parts of the world, Rottweilers are now also used as search and rescue dogs, guard dogs, and police dogs.

Technically a ""medium / large"" breed, according to the FCI standard the Rottweiler stands 61–69 cm (24–27 in) at the withers for males, 56–63 cm (22–25 in) for females, and the weight must be between 50 and 60 kg (110 and 132 lbs) for males and 35 and 48 kg (77 and 105 lbs) for females. Weight must be relative to height.
"
Saola,Up to 90,Up to 100,"Brown, White",Up to 21,Herbivore,Forests,"Tigers, Leopards",26,"Vietnam, Laos",Critically Endangered,Bovidae,240,26,Solitary,1,"The saola (Pseudoryx nghetinhensis), also called spindlehorn, Asian unicorn, or infrequently, Vu Quang bovid, is one of the world's rarest large mammals, a forest-dwelling bovine native to the Annamite Range in Vietnam and Laos. It was described in 1993 following a discovery of remains in Vũ Quang National Park by a joint survey of the Vietnamese Ministry of Forestry and the World Wide Fund for Nature. 
Saolas have since been kept in captivity multiple times, although only for short periods as they died within a matter of weeks to months. The species was first reported in 1992 by Do Tuoc, a forest ecologist, and his associates. The first photograph of a living saola was taken in captivity in 1993. The most recent one was taken in 2013 by a movement-triggered camera in the forest of central Vietnam. It is the only species in the genus Pseudoryx.
"
Secretary Bird,100-150,2.3-4.5,"Black, Grey",15-Oct,Carnivore,"Grasslands, Savannas","Snakes, Lizards",24,Africa,Least Concern,Sagittariidae,42-46,32,Solitary,2,"The secretarybird or secretary bird (Sagittarius serpentarius) is a large bird of prey that is endemic to Africa. It is mostly terrestrial, spending most of its time on the ground, and is usually found in the open grasslands and savanna of the sub-Saharan region. John Frederick Miller described the species in 1779. A member of the order Accipitriformes, which also includes many other diurnal birds of prey such as eagles, hawks, kites, vultures, and harriers, it is placed in its own family, Sagittariidae.

The secretarybird is instantly recognizable as a very large bird with an eagle-like body on crane-like legs that give the bird a height of as much as 1.3 m (4 ft 3 in). The sexes are similar in appearance. Adults have a featherless red-orange face and predominantly grey plumage, with a flattened dark crest and black flight feathers and thighs.

Breeding can take place at any time of year but tends to be late in the dry season. The nest is built at the top of a thorny tree, and a clutch of one to three eggs is laid. In years with plentiful food all three young can survive to fledging. The secretarybird hunts and catches prey on the ground, often stomping on victims to kill them. Insects and small vertebrates make up its diet.

Although the secretarybird resides over a large range, the results of localised surveys suggest that the total population is experiencing a rapid decline, probably as a result of habitat destruction. The species is therefore classed as Endangered by the International Union for Conservation of Nature. The secretarybird appears on the coats of arms of Sudan and South Africa."
Serval,54-62,18-Aug,"Yellowish-Tan, Black",12-Oct,Carnivore,"Grasslands, Wetlands","Leopards, Hyenas",44,Africa,Least Concern,Felidae,54-72,44,Solitary,1,"The serval (Leptailurus serval) is a wild cat native to Africa. It is widespread in sub-Saharan countries, except rainforest regions. Across its range, it occurs in protected areas, and hunting it is either prohibited or regulated in range countries.

It is the sole member of the genus Leptailurus. Three subspecies are recognised. The serval is a slender, medium-sized cat that stands 54–62 cm (21–24 in) at the shoulder and weighs 9–18 kg (20–40 lb). It is characterised by a small head, large ears, a golden-yellow to buff coat spotted and striped with black, and a short, black-tipped tail. The serval has the longest legs of any cat relative to its body size.

The serval is a solitary carnivore and active both by day and at night. It preys on rodents, particularly vlei rats, small birds, frogs, insects, and reptiles, using its sense of hearing to locate prey. It leaps over 2 m (6 ft 7 in) above the ground to land on the prey on its forefeet, and finally kills it with a bite on the neck or the head. Both sexes establish highly overlapping home ranges of 10 to 32 km2 (4 to 12 sq mi), and mark them with feces and saliva. Mating takes place at different times of the year in different parts of their range, but typically once or twice a year in an area. After a gestational period of two to three months, a litter of one to four is born. The kittens are weaned at the age of one month and begin hunting on their own at six months of age. They leave their mother at the age of around 12 months."
Shoebill,110-140,06-Apr,Grayish-brown,30-35,Carnivore,"Swamps, Marshes","Crocodiles, Snakes",14-16,Tropical Central Tropical Africa,Vulnerable,Balaenicipitidae,30-35,14-16,Solitary,03-Jan,"The shoebill (Balaeniceps rex), also known as the whale-headed stork, and shoe-billed stork, is a large long-legged wading bird. It derives its name from its enormous shoe-shaped bill. It has a somewhat stork-like overall form and has previously been classified with the storks in the order Ciconiiformes based on this morphology. However, genetic evidence places it with pelicans and herons in the Pelecaniformes. The adult is mainly grey while the juveniles are more brown. It lives in tropical East Africa in large swamps from South Sudan to Zambia.

The shoebill is normally silent, but they perform bill-clattering displays at the nest. When engaging in these displays, adult birds have also been noted to utter a cow-like moo as well as high-pitched whines. Both nestlings and adults engage in bill-clattering during the nesting season as a means of communication. When young are begging for food, they call out with a sound uncannily like human hiccups. In one case, a flying adult bird was heard uttering hoarse croaks, apparently as a sign of aggression at a nearby marabou stork (Leptoptilos crumeniferus)
"
Shortfin Mako Shark,Up to 394,Up to 800,Metallic Blue,28-35,Carnivore,Oceans,Larger Sharks,45,Worldwide,Vulnerable,Lamnidae,20-24,45,Solitary,1,"The shortfin mako shark (Isurus oxyrinchus), also known as the shortfin mako, blue pointer, or bonito shark, is a large mackerel shark. It is commonly referred to as the mako shark, as is the longfin mako shark (Isurus paucus). The fastest known shark species, able to reach speeds of 74 km/h (46 mph) in bursts, the shortfin mako can attain a size of 4 m (13 ft) in length and weigh 570 kg (1,260 lb). The species is classified as Endangered by the IUCN.

Shortfin mako sharks are known to be highly migratory, with individuals making long migrations every year. Like the true tunas, the great white shark, and some other fishes, the shortfin mako shark has a specialized blood vessel structure – called a countercurrent exchanger – that allows them to maintain a body temperature that is higher than the surrounding water. This adaptation provides them with a major advantage when hunting in cold water by allowing them to move more quickly and intelligently. This species feeds on a variety of prey. They are known to primarily eat bony fishes (including relatively large tunas) and squids but also eat other sharks, small marine mammals, sea turtles, and even dead organic matter. Shortfin makos are at the top of the pelagic food web, and adults do not have any known natural predators. Juveniles are likely eaten by other sharks and perhaps by cannibalistic adults.
"
Siberian Husky,50-60,16-27,Various,14-Dec,Carnivore,Cold Regions,"Wolves, Bears",50-65,"Siberia, Alaska",Not Applicable,Canidae,60-63,48,Pack-based,06-Apr,"The Siberian Husky is a medium-sized working sled dog breed. The breed belongs to the Spitz genetic family. It is recognizable by its thickly furred double coat, erect triangular ears, and distinctive markings, and is smaller than the similar-looking Alaskan Malamute.

Siberian Huskies originated in Northeast Asia where they are bred by the Chukchi people as well as the Koryak, Yukaghir and Kamchadal people of Siberia for sled pulling and companionship. It is an active, energetic, resilient breed, whose ancestors lived in the extremely cold and harsh environment of the Siberian Arctic. William Goosak, a Russian fur trader, introduced them to Nome, Alaska, during the Nome Gold Rush, initially as sled dogs to work the mining fields and for expeditions through otherwise impassable terrain. Today, the Siberian Husky is typically kept as a house pet, though they are still frequently used as sled dogs by competitive and recreational mushers.
"
Sloth,50-60,3.6-9,"Brown, Gray",16-Oct,Herbivore,Rainforests,"Jaguars, Harpy Eagles",0.03-0.24,Central and South America,Least Concern,Bradypodidae,120-180,0.03-0.24,Solitary,1,"Sloths are a Neotropical group of xenarthran mammals constituting the suborder Folivora, including the extant arboreal tree sloths and extinct terrestrial ground sloths. Noted for their slowness of movement, tree sloths spend most of their lives hanging upside down in the trees of the tropical rainforests of South America and Central America. Sloths are considered to be most closely related to anteaters, together making up the xenarthran order Pilosa.

There are six extant sloth species in two genera – Bradypus (three-toed sloths) and Choloepus (two-toed sloths). Despite this traditional naming, all sloths have three toes on each rear limb – although two-toed sloths have only two digits on each forelimb. The two groups of sloths are from different, distantly related families, and are thought to have evolved their morphology via parallel evolution from terrestrial ancestors. Besides the extant species, many species of ground sloths ranging up to the size of elephants (like Megatherium) inhabited both North and South America during the Pleistocene Epoch. However, they became extinct during the Quaternary extinction event around 12,000 years ago, along with most large animals across the Americas. The extinction correlates in time with the arrival of humans, but climate change has also been suggested to have contributed. Members of an endemic radiation of Caribbean sloths also formerly lived in the Greater Antilles but became extinct after humans settled the archipelago in the mid-Holocene, around 6,000 years ago.

Sloths are so named because of their very low metabolism and deliberate movements. Sloth, related to slow, literally means ""laziness"", and their common names in several other languages (e.g. German: Faultier, French: paresseux, Spanish: perezoso, Romanian: leneș, Finnish: laiskiainen) also mean ""lazy"" or similar. Their slowness permits their low-energy diet of leaves and avoids detection by predatory hawks and cats that hunt by sight. Sloths are almost helpless on the ground but are able to swim. The shaggy coat has grooved hair that is host to symbiotic green algae which camouflage the animal in the trees and provide it nutrients. The algae also nourish sloth moths, some species of which exist solely on sloths.
"
Slow Loris,20-38,0.3-1.6,Yellowish-Brown,20-24,Omnivore,Forests,"Birds, Snakes",Not Applicable,Southeast Asia,Vulnerable,Lorisidae,23-26,Not Applicable,Solitary,Up to 10,"Slow lorises are a group of several species of nocturnal strepsirrhine primates that make up the genus Nycticebus. Found in Southeast Asia and nearby areas, they range from Bangladesh and Northeast India in the west to the Sulu Archipelago in the Philippines in the east, and from Yunnan province in China in the north to the island of Java in the south.

Slow lorises have a round head, a narrow snout, large eyes, and a variety of distinctive coloration patterns that are species-dependent. Their arms and legs are nearly equal in length, and their torso is long and flexible, allowing them to twist and extend to nearby branches. The hands and feet of slow lorises have several adaptations that give them a pincer-like grip and enable them to grasp branches for long periods of time. Slow lorises have a toxic bite, a trait rare among mammals and unique among the primates. The toxin is obtained by licking a sweat gland on their arm, and the secretion is activated by mixing with saliva. Their toxic bite, once thought to be primarily a deterrent to predators, has been discovered to be primarily used in disputes within the species.

The secretion from the arm contains a chemical related to cat allergen, but may be augmented by secondary toxins from the diet in wild individuals. Slow lorises move slowly and deliberately, making little or no noise, and when threatened, they stop moving and remain motionless. Their only documented predators—apart from humans—include snakes, changeable hawk-eagles and orangutans, although cats, viverrids and sun bears are suspected. Little is known about their social structure, but they are known to communicate by scent marking. Males are highly territorial. Slow lorises reproduce slowly, and the infants are initially parked on branches or carried by either parent. They are omnivores, eating small animals, fruit, tree gum, and other vegetation.

Each of the slow loris species that had been identified prior to 2012 is listed as either ""Vulnerable"" or ""Endangered"" on the IUCN Red List. The three newest species are yet to be evaluated, but they arise from (and further reduce the ranks of) what was thought to be a single ""vulnerable"" species. All four of these are expected to be listed with at least the same, if not a higher-risk, conservation status. All slow lorises are threatened by the wildlife trade and habitat loss. Their habitat is rapidly disappearing and becoming fragmented, making it nearly impossible for slow lorises to disperse between forest fragments; unsustainable demand from the exotic pet trade and from traditional medicine has been the greatest cause for their decline.
"
